{
    "id": "spec_enhance_royal_01",
    "name": "学习爆能强化皇家护卫吧！",
    "category": "puzzle",
    "reference_resolution": [
        1280,
        720
    ],
    "navigation": {
        "display_name": "学习爆能强化皇家护卫吧！",
        "name_pattern": ".*学习爆能强化皇家护卫.*",
        "categories": [
            {
                "display_name": "盘面解密",
                "pattern": "盘面解(密|谜)|盤面解(密|謎)",
                "scope": "tab"
            },
            {
                "display_name": "指定系列",
                "pattern": "指定系列",
                "scope": "tab"
            },
            {
                "display_name": "爆能强化皇家护卫",
                "pattern": "^爆能强化皇家护卫$",
                "scope": "list"
            }
        ],
        "entry_wait_ms": 3500,
        "search_swipes": 30
    },
    "steps": [
        {
            "action": "play_card",
            "label": "使用古旧天剑，加入天剑深渊",
            "change_roi": "battle_board",
            "post_timeout_ms": 10000,
            "after_ms": 4000,
            "hand_index": 1,
            "hand_count": 2,
            "expand_delay_ms": 1000
        },
        {
            "action": "evolve",
            "label": "手动normal进化当前第4/4随从",
            "change_roi": "battle_board",
            "post_timeout_ms": 10000,
            "after_ms": 15000,
            "evolution_type": "normal",
            "target": {
                "type": "ally_follower",
                "index": 4,
                "count": 4
            }
        },
        {
            "action": "play_card",
            "label": "以五费爆能使用兰德尔，获得疾驰并全场强化",
            "change_roi": "battle_board",
            "post_timeout_ms": 10000,
            "after_ms": 4000,
            "hand_index": 1,
            "hand_count": 2,
            "expand_delay_ms": 1000
        },
        {
            "action": "play_card",
            "label": "天剑深渊清除右侧二攻三血守护",
            "change_roi": "battle_board",
            "post_timeout_ms": 10000,
            "after_ms": 4000,
            "hand_index": 1,
            "hand_count": 1,
            "expand_delay_ms": 1000,
            "target": {
                "type": "enemy_follower",
                "index": 2,
                "count": 2
            }
        },
        {
            "action": "attack",
            "label": "五攻古旧天剑清除剩余五血守护",
            "change_roi": "battle_board",
            "post_timeout_ms": 10000,
            "after_ms": 2500,
            "attacker_index": 4,
            "ally_count": 5,
            "target": {
                "type": "enemy_follower",
                "index": 1,
                "count": 1
            }
        },
        {
            "action": "attack",
            "label": "第1个三攻骑士攻击主战者",
            "change_roi": "battle_board",
            "post_timeout_ms": 10000,
            "after_ms": 2500,
            "attacker_index": 1,
            "ally_count": 5,
            "target": {
                "type": "enemy_leader"
            }
        },
        {
            "action": "attack",
            "label": "第2个三攻骑士攻击主战者",
            "change_roi": "battle_board",
            "post_timeout_ms": 10000,
            "after_ms": 2500,
            "attacker_index": 2,
            "ally_count": 5,
            "target": {
                "type": "enemy_leader"
            }
        },
        {
            "action": "attack",
            "label": "第3个三攻骑士攻击主战者",
            "change_roi": "battle_board",
            "post_timeout_ms": 10000,
            "after_ms": 2500,
            "attacker_index": 3,
            "ally_count": 5,
            "target": {
                "type": "enemy_leader"
            }
        },
        {
            "action": "attack",
            "label": "五攻疾驰兰德尔完成斩杀",
            "change_roi": "battle_board",
            "post_timeout_ms": 10000,
            "after_ms": 2500,
            "attacker_index": 5,
            "ally_count": 5,
            "target": {
                "type": "enemy_leader"
            }
        }
    ]
}
