{
    "id": "spec_collaboration_2_02",
    "name": "熟练运用【协作】吧！",
    "category": "puzzle",
    "reference_resolution": [
        1280,
        720
    ],
    "navigation": {
        "display_name": "熟练运用【协作】吧！",
        "name_pattern": ".*熟练运用.*协作.*.*",
        "categories": [
            {
                "display_name": "盘面解谜",
                "pattern": "盘面解(密|谜)|盤面解(密|謎)",
                "scope": "tab"
            },
            {
                "display_name": "指定系列",
                "pattern": "指定系列",
                "scope": "tab"
            },
            {
                "display_name": "协作②",
                "pattern": "^协作(②|2)$",
                "scope": "list"
            }
        ],
        "entry_wait_ms": 3500,
        "search_swipes": 8
    },
    "steps": [
        {
            "action": "play_card",
            "label": "玛尔斯入场召唤三名骑士",
            "change_roi": "hand_and_board",
            "post_timeout_ms": 10000,
            "after_ms": 4000,
            "hand_index": 1,
            "hand_count": 4,
            "expand_delay_ms": 1000
        },
        {
            "action": "evolve",
            "label": "手动super进化",
            "change_roi": "hand_and_board",
            "post_timeout_ms": 10000,
            "after_ms": 22000,
            "evolution_type": "super",
            "target": {
                "type": "ally_follower",
                "index": 1,
                "count": 4
            }
        },
        {
            "action": "attack",
            "label": "末位骑士削右守护三点并腾卡位",
            "change_roi": "hand_and_board",
            "post_timeout_ms": 10000,
            "after_ms": 2500,
            "attacker_index": 5,
            "ally_count": 5,
            "target": {
                "type": "enemy_follower",
                "index": 3,
                "count": 3
            }
        },
        {
            "action": "play_card",
            "label": "协作10无音的包围获得两名突进铁甲骑士",
            "change_roi": "hand_and_board",
            "post_timeout_ms": 10000,
            "after_ms": 4000,
            "hand_index": 1,
            "hand_count": 3,
            "expand_delay_ms": 1000,
            "expand_hand": false
        },
        {
            "action": "play_card",
            "label": "第一名铁甲骑士令玛尔斯九攻",
            "change_roi": "hand_and_board",
            "post_timeout_ms": 10000,
            "after_ms": 4000,
            "hand_index": 3,
            "hand_count": 4,
            "expand_delay_ms": 1000
        },
        {
            "action": "attack",
            "label": "四攻铁甲骑士削左守护至三血",
            "change_roi": "hand_and_board",
            "post_timeout_ms": 10000,
            "after_ms": 2500,
            "attacker_index": 5,
            "ally_count": 5,
            "target": {
                "type": "enemy_follower",
                "index": 1,
                "count": 3
            }
        },
        {
            "action": "attack",
            "label": "骑士清左守护",
            "change_roi": "hand_and_board",
            "post_timeout_ms": 10000,
            "after_ms": 2500,
            "attacker_index": 4,
            "ally_count": 4,
            "target": {
                "type": "enemy_follower",
                "index": 1,
                "count": 3
            }
        },
        {
            "action": "attack",
            "label": "骑士清右残血守护",
            "change_roi": "hand_and_board",
            "post_timeout_ms": 10000,
            "after_ms": 2500,
            "attacker_index": 3,
            "ally_count": 3,
            "target": {
                "type": "enemy_follower",
                "index": 2,
                "count": 2
            }
        },
        {
            "action": "use_extra_energy",
            "label": "使用额外能量",
            "change_roi": "hand_and_board",
            "post_timeout_ms": 10000,
            "after_ms": 4000
        },
        {
            "action": "play_card",
            "label": "第二名铁甲骑士令玛尔斯十攻",
            "change_roi": "hand_and_board",
            "post_timeout_ms": 10000,
            "after_ms": 4000,
            "hand_index": 3,
            "hand_count": 3,
            "expand_delay_ms": 1000
        },
        {
            "action": "attack",
            "label": "铁甲骑士削剩余守护至一血",
            "change_roi": "hand_and_board",
            "post_timeout_ms": 10000,
            "after_ms": 2500,
            "attacker_index": 3,
            "ally_count": 3,
            "target": {
                "type": "enemy_follower",
                "index": 1,
                "count": 1
            }
        },
        {
            "action": "attack",
            "label": "最后骑士清守护",
            "change_roi": "hand_and_board",
            "post_timeout_ms": 10000,
            "after_ms": 2500,
            "attacker_index": 2,
            "ally_count": 2,
            "target": {
                "type": "enemy_follower",
                "index": 1,
                "count": 1
            }
        },
        {
            "action": "attack",
            "label": "十攻玛尔斯斩杀",
            "change_roi": "hand_and_board",
            "post_timeout_ms": 10000,
            "after_ms": 2500,
            "attacker_index": 1,
            "ally_count": 1,
            "target": {
                "type": "enemy_leader"
            }
        }
    ]
}
