{
    "id": "puzzle_001",
    "name": "同时学习【守护】【突进】【疾驰】吧！",
    "category": "puzzle",
    "reference_resolution": [1280, 720],
    "navigation": {
        "display_name": "同时学习【守护】【突进】【疾驰】吧！",
        "name_pattern": ".*守护.*突(进|击).*疾驰.*",
        "categories": [
            {
                "display_name": "盘面解密",
                "pattern": "盘面解(密|谜)|盤面解(密|謎)",
                "scope": "tab"
            },
            {
                "display_name": "指定系列",
                "pattern": "指定系列",
                "scope": "tab"
            },
            {
                "display_name": "基本能力①",
                "pattern": "基本能力(①|1)",
                "scope": "list"
            }
        ],
        "entry_wait_ms": 3500,
        "search_swipes": 20
    },
    "points": {},
    "steps": [
        {
            "action": "play_card",
            "hand_index": 2,
            "hand_count": 2,
            "label": "使用第二张手牌部署",
            "change_roi": "battle_board",
            "post_timeout_ms": 5000,
            "after_ms": 500
        },
        {
            "action": "play_card",
            "hand_index": 1,
            "hand_count": 1,
            "label": "使用第一张手牌部署",
            "change_roi": "battle_board",
            "post_timeout_ms": 5000,
            "after_ms": 500
        },
        {
            "action": "attack",
            "attacker_index": 1,
            "ally_count": 2,
            "target": {
                "type": "enemy_follower",
                "index": 1,
                "count": 1
            },
            "label": "第一个场上随从攻击对方第一个随从",
            "change_roi": "battle_board",
            "post_timeout_ms": 5000,
            "after_ms": 400
        },
        {
            "action": "attack",
            "attacker_index": 1,
            "ally_count": 1,
            "target": {
                "type": "enemy_leader"
            },
            "label": "第二个场上随从攻击对方主战者",
            "change_roi": "battle_board",
            "post_timeout_ms": 5000,
            "after_ms": 400
        }
    ]
}
