{
    "id": "spec_collaboration_1_02",
    "name": "熟练运用【协作】吧！",
    "category": "puzzle",
    "reference_resolution": [
        1280,
        720
    ],
    "navigation": {
        "display_name": "熟练运用【协作】吧！",
        "name_pattern": ".*熟练运用.*协作.*.*",
        "categories": [
            {
                "display_name": "盘面解谜",
                "pattern": "盘面解(密|谜)|盤面解(密|謎)",
                "scope": "tab"
            },
            {
                "display_name": "指定系列",
                "pattern": "指定系列",
                "scope": "tab"
            },
            {
                "display_name": "协作①",
                "pattern": "^协作(①|1)$",
                "scope": "list"
            }
        ],
        "entry_wait_ms": 3500,
        "search_swipes": 8
    },
    "steps": [
        {
            "action": "play_card",
            "label": "须臾剑士入场，使协作从19达到20",
            "change_roi": "hand_and_board",
            "post_timeout_ms": 10000,
            "after_ms": 4000,
            "hand_index": 4,
            "hand_count": 4,
            "expand_delay_ms": 1000,
            "expand_hand": true
        },
        {
            "action": "play_card",
            "label": "统音在协作20条件下自动普通进化，获得纹章并召唤两名铁甲骑士",
            "change_roi": "hand_and_board",
            "post_timeout_ms": 10000,
            "after_ms": 12000,
            "hand_index": 1,
            "hand_count": 3,
            "expand_delay_ms": 1000,
            "expand_hand": false
        },
        {
            "action": "play_card",
            "label": "谍报兵入场，纹章对主战者造成一点伤害",
            "change_roi": "hand_and_board",
            "post_timeout_ms": 10000,
            "after_ms": 4000,
            "hand_index": 2,
            "hand_count": 2,
            "expand_delay_ms": 1000,
            "expand_hand": false
        },
        {
            "action": "attack",
            "label": "谍报兵与第四名一攻二血守护交换，谢幕骑士再次触发纹章",
            "change_roi": "hand_and_board",
            "post_timeout_ms": 10000,
            "after_ms": 5000,
            "attacker_index": 5,
            "ally_count": 5,
            "target": {
                "type": "enemy_follower",
                "index": 4,
                "count": 5
            }
        },
        {
            "action": "attack",
            "label": "六攻统音削超进化守护至一血",
            "change_roi": "hand_and_board",
            "post_timeout_ms": 10000,
            "after_ms": 5000,
            "attacker_index": 2,
            "ally_count": 5,
            "target": {
                "type": "enemy_follower",
                "index": 4,
                "count": 4
            }
        },
        {
            "action": "attack",
            "label": "谢幕骑士清除一血超进化守护",
            "change_roi": "hand_and_board",
            "post_timeout_ms": 10000,
            "after_ms": 5000,
            "attacker_index": 5,
            "ally_count": 5,
            "target": {
                "type": "enemy_follower",
                "index": 4,
                "count": 4
            }
        },
        {
            "action": "attack",
            "label": "右铁甲骑士清除右侧二血守护",
            "change_roi": "hand_and_board",
            "post_timeout_ms": 10000,
            "after_ms": 5000,
            "attacker_index": 4,
            "ally_count": 4,
            "target": {
                "type": "enemy_follower",
                "index": 3,
                "count": 3
            }
        },
        {
            "action": "attack",
            "label": "左铁甲骑士清除左侧二血守护",
            "change_roi": "hand_and_board",
            "post_timeout_ms": 10000,
            "after_ms": 5000,
            "attacker_index": 3,
            "ally_count": 4,
            "target": {
                "type": "enemy_follower",
                "index": 1,
                "count": 2
            }
        },
        {
            "action": "evolve",
            "label": "手动普通进化须臾剑士至三攻三血",
            "change_roi": "hand_and_board",
            "post_timeout_ms": 10000,
            "after_ms": 15000,
            "evolution_type": "normal",
            "target": {
                "type": "ally_follower",
                "index": 1,
                "count": 4
            }
        },
        {
            "action": "play_card",
            "label": "吉尔入场前按四占位选择须臾剑士，使其变为五攻一血",
            "change_roi": "hand_and_board",
            "post_timeout_ms": 10000,
            "after_ms": 4000,
            "hand_index": 1,
            "hand_count": 1,
            "expand_delay_ms": 1000,
            "target": {
                "type": "ally_follower",
                "index": 1,
                "count": 4
            },
            "target_delay_ms": 1500
        },
        {
            "action": "attack",
            "label": "五攻须臾剑士斩杀",
            "change_roi": "hand_and_board",
            "post_timeout_ms": 10000,
            "after_ms": 5000,
            "attacker_index": 1,
            "ally_count": 5,
            "target": {
                "type": "enemy_leader"
            }
        }
    ]
}
