{
    "id": "spec_rodeo_bishop_01",
    "name": "学习罗德欧主教吧！",
    "category": "puzzle",
    "reference_resolution": [
        1280,
        720
    ],
    "navigation": {
        "display_name": "学习罗德欧主教吧！",
        "name_pattern": ".*学习罗德欧主教.*",
        "categories": [
            {
                "display_name": "盘面解谜",
                "pattern": "盘面解(密|谜)|盤面解(密|謎)",
                "scope": "tab"
            },
            {
                "display_name": "指定系列",
                "pattern": "指定系列",
                "scope": "tab"
            },
            {
                "display_name": "罗德欧主教",
                "pattern": "^罗德欧主教$",
                "scope": "list"
            }
        ],
        "entry_wait_ms": 3500,
        "search_swipes": 8
    },
    "steps": [
        {
            "action": "play_card",
            "label": "使用零费护符，令场上护符达到两张",
            "change_roi": "hand_and_board",
            "post_timeout_ms": 10000,
            "after_ms": 4000,
            "hand_index": 3,
            "hand_count": 3,
            "expand_delay_ms": 1000
        },
        {
            "action": "play_card",
            "label": "海蚀三叉戟入场对右侧五血随从造成四点",
            "change_roi": "hand_and_board",
            "post_timeout_ms": 10000,
            "after_ms": 4000,
            "hand_index": 2,
            "hand_count": 2,
            "expand_delay_ms": 1000,
            "target": {
                "type": "enemy_follower",
                "index": 2,
                "count": 2
            },
            "target_delay_ms": 1500
        },
        {
            "action": "play_card",
            "label": "神圣策划人以三护符条件清除左侧守护",
            "change_roi": "hand_and_board",
            "post_timeout_ms": 10000,
            "after_ms": 4000,
            "hand_index": 1,
            "hand_count": 1,
            "expand_delay_ms": 1000,
            "target": {
                "type": "enemy_follower",
                "index": 1,
                "count": 2
            },
            "target_delay_ms": 1500
        },
        {
            "action": "activate_amulet",
            "label": "启动三叉戟清除最后一血随从",
            "change_roi": "hand_and_board",
            "post_timeout_ms": 10000,
            "after_ms": 4000,
            "amulet_index": 3,
            "ally_count": 4,
            "target": {
                "type": "enemy_follower",
                "index": 1,
                "count": 1
            },
            "target_delay_ms": 1500
        }
    ]
}
