{
    "id": "spec_amulet_bishop_1_01",
    "name": "学习护符主教吧！",
    "category": "puzzle",
    "reference_resolution": [
        1280,
        720
    ],
    "navigation": {
        "display_name": "学习护符主教吧！",
        "name_pattern": ".*学习护符主教.*",
        "categories": [
            {
                "display_name": "盘面解密",
                "pattern": "盘面解(密|谜)|盤面解(密|謎)",
                "scope": "tab"
            },
            {
                "display_name": "指定系列",
                "pattern": "指定系列",
                "scope": "tab"
            },
            {
                "display_name": "护符主教1",
                "pattern": "^护符主教(①|1)$",
                "scope": "list"
            }
        ],
        "entry_wait_ms": 3500,
        "search_swipes": 8
    },
    "steps": [
        {
            "action": "play_card",
            "label": "放置救赎的圣典护符",
            "change_roi": "battle_board",
            "post_timeout_ms": 10000,
            "after_ms": 2500,
            "hand_index": 3,
            "hand_count": 4,
            "expand_delay_ms": 1000
        },
        {
            "action": "play_card",
            "label": "使用野兽公主的誓约，凑齐四个护符",
            "change_roi": "battle_board",
            "post_timeout_ms": 10000,
            "after_ms": 2500,
            "hand_index": 3,
            "hand_count": 3,
            "expand_delay_ms": 1000
        },
        {
            "action": "play_card",
            "label": "终焉的白骨圣堂主破坏四护符，触发全场伤害及抽牌召唤",
            "change_roi": "battle_board",
            "post_timeout_ms": 10000,
            "after_ms": 10000,
            "hand_index": 1,
            "hand_count": 2,
            "expand_delay_ms": 1000
        },
        {
            "action": "attack",
            "label": "第一个神圣猎鹰攻击主战者",
            "change_roi": "battle_board",
            "post_timeout_ms": 10000,
            "after_ms": 2500,
            "attacker_index": 2,
            "ally_count": 4,
            "target": {
                "type": "enemy_leader"
            }
        },
        {
            "action": "attack",
            "label": "第二个神圣猎鹰攻击主战者完成斩杀",
            "change_roi": "battle_board",
            "post_timeout_ms": 10000,
            "after_ms": 2500,
            "attacker_index": 3,
            "ally_count": 4,
            "target": {
                "type": "enemy_leader"
            }
        }
    ]
}
