{
    "id": "spec_buff_elf_01",
    "name": "学习增益精灵吧！",
    "category": "puzzle",
    "reference_resolution": [
        1280,
        720
    ],
    "navigation": {
        "display_name": "学习增益精灵吧！",
        "name_pattern": ".*学习增益精灵.*",
        "categories": [
            {
                "display_name": "盘面解谜",
                "pattern": "盘面解(密|谜)|盤面解(密|謎)",
                "scope": "tab"
            },
            {
                "display_name": "指定系列",
                "pattern": "指定系列",
                "scope": "tab"
            },
            {
                "display_name": "增益精灵",
                "pattern": "^增益精灵$",
                "scope": "list"
            }
        ],
        "entry_wait_ms": 3500,
        "search_swipes": 8
    },
    "steps": [
        {
            "action": "play_card",
            "label": "使用太古的妖精露芙蕾",
            "change_roi": "hand_and_board",
            "post_timeout_ms": 10000,
            "after_ms": 4000,
            "hand_index": 1,
            "hand_count": 3,
            "expand_delay_ms": 1000,
            "expand_hand": true
        },
        {
            "action": "play_card",
            "label": "四费爆能蒂亚，强化并获得伊芙",
            "change_roi": "hand_and_board",
            "post_timeout_ms": 10000,
            "after_ms": 4000,
            "hand_index": 1,
            "hand_count": 2,
            "expand_delay_ms": 1000
        },
        {
            "action": "play_card",
            "label": "使用疾驰伊芙",
            "change_roi": "hand_and_board",
            "post_timeout_ms": 10000,
            "after_ms": 4000,
            "hand_index": 2,
            "hand_count": 2,
            "expand_delay_ms": 1000
        },
        {
            "action": "attack",
            "label": "妖精先攻击守护削至三血",
            "change_roi": "hand_and_board",
            "post_timeout_ms": 10000,
            "after_ms": 2500,
            "attacker_index": 3,
            "ally_count": 4,
            "target": {
                "type": "enemy_follower",
                "index": 1,
                "count": 1
            }
        },
        {
            "action": "attack",
            "label": "蒂亚清除守护",
            "change_roi": "hand_and_board",
            "post_timeout_ms": 10000,
            "after_ms": 2500,
            "attacker_index": 2,
            "ally_count": 3,
            "target": {
                "type": "enemy_follower",
                "index": 1,
                "count": 1
            }
        },
        {
            "action": "attack",
            "label": "伊芙三攻斩杀",
            "change_roi": "hand_and_board",
            "post_timeout_ms": 10000,
            "after_ms": 2500,
            "attacker_index": 3,
            "ally_count": 3,
            "target": {
                "type": "enemy_leader"
            }
        }
    ]
}
