{
    "id": "spec_castorotte_02",
    "name": "熟练运用卡特斯罗特超越者吧！",
    "category": "puzzle",
    "reference_resolution": [
        1280,
        720
    ],
    "navigation": {
        "display_name": "熟练运用卡特斯罗特超越者吧！",
        "name_pattern": ".*熟练运用卡特斯罗特超越者吧.*",
        "categories": [
            {
                "display_name": "盘面解密",
                "pattern": "盘面解(密|谜)|盤面解(密|謎)",
                "scope": "tab"
            },
            {
                "display_name": "指定系列",
                "pattern": "指定系列",
                "scope": "tab"
            },
            {
                "display_name": "卡特斯罗特超越者",
                "pattern": "卡特斯罗特超越者",
                "scope": "list"
            }
        ],
        "entry_wait_ms": 3500,
        "search_swipes": 20
    },
    "steps": [
        {
            "action": "play_card",
            "hand_index": 1,
            "hand_count": 3,
            "target": {
                "type": "enemy_follower",
                "index": 1,
                "count": 5
            },
            "label": "青锈小卒指定敌方左起第一个五攻四血随从；等待纹章自动进化",
            "change_roi": "battle_board",
            "post_timeout_ms": 8000,
            "after_ms": 6500,
            "expand_hand": true,
            "expand_delay_ms": 1000
        },
        {
            "action": "attack",
            "attacker_index": 1,
            "ally_count": 1,
            "target": {
                "type": "enemy_follower",
                "index": 3,
                "count": 4
            },
            "label": "进化后的小卒攻击重排后的第三个二攻二血随从",
            "change_roi": "battle_board",
            "post_timeout_ms": 8000,
            "after_ms": 1500
        },
        {
            "action": "play_card",
            "hand_index": 2,
            "hand_count": 2,
            "label": "保留解析的创造物，使用第二张七费随从并等待召唤和随机破坏",
            "change_roi": "battle_board",
            "post_timeout_ms": 8000,
            "after_ms": 4000,
            "expand_hand": true,
            "expand_delay_ms": 1000
        },
        {
            "action": "evolve",
            "evolution_type": "super",
            "target": {
                "type": "ally_follower",
                "index": 2,
                "count": 3
            },
            "label": "超进化当前第二个随从，等待第二次召唤和随机破坏",
            "change_roi": "battle_board",
            "post_timeout_ms": 8000,
            "after_ms": 12000
        },
        {
            "action": "attack",
            "attacker_index": 2,
            "ally_count": 4,
            "target": {
                "type": "enemy_follower",
                "index": 1,
                "count": 1
            },
            "label": "八攻超进化随从攻击两次随机破坏后唯一剩余的敌方随从",
            "change_roi": "battle_board",
            "post_timeout_ms": 8000,
            "after_ms": 1500
        }
    ]
}
