{
    "id": "spec_collaboration_1_01",
    "name": "学习【协作】吧！",
    "category": "puzzle",
    "reference_resolution": [
        1280,
        720
    ],
    "navigation": {
        "display_name": "学习【协作】吧！",
        "name_pattern": ".*学习.*协作.*.*",
        "categories": [
            {
                "display_name": "盘面解谜",
                "pattern": "盘面解(密|谜)|盤面解(密|謎)",
                "scope": "tab"
            },
            {
                "display_name": "指定系列",
                "pattern": "指定系列",
                "scope": "tab"
            },
            {
                "display_name": "协作①",
                "pattern": "^协作(①|1)$",
                "scope": "list"
            }
        ],
        "entry_wait_ms": 3500,
        "search_swipes": 8
    },
    "steps": [
        {
            "action": "play_card",
            "label": "先使用听略谍报兵，使协作达到5",
            "change_roi": "hand_and_board",
            "post_timeout_ms": 10000,
            "after_ms": 4000,
            "hand_index": 3,
            "hand_count": 3,
            "expand_delay_ms": 1000
        },
        {
            "action": "play_card",
            "label": "响爪分队长召唤三名骑士，使协作达到9",
            "change_roi": "hand_and_board",
            "post_timeout_ms": 10000,
            "after_ms": 4000,
            "hand_index": 2,
            "hand_count": 2,
            "expand_delay_ms": 1000
        },
        {
            "action": "select_choice",
            "label": "选择进攻模式：其他随从加一攻并获得突进",
            "change_roi": "hand_and_board",
            "post_timeout_ms": 10000,
            "after_ms": 4000,
            "choice_index": 1,
            "choice_count": 2
        },
        {
            "action": "attack",
            "label": "三攻谍报兵削右侧九血守护并离场，谢幕骑士使协作达到10",
            "change_roi": "hand_and_board",
            "post_timeout_ms": 10000,
            "after_ms": 2500,
            "attacker_index": 1,
            "ally_count": 5,
            "target": {
                "type": "enemy_follower",
                "index": 4,
                "count": 4
            }
        },
        {
            "action": "play_card",
            "label": "拔刀指定第三名随从：六点单体及五点全场伤害",
            "change_roi": "hand_and_board",
            "post_timeout_ms": 10000,
            "after_ms": 4000,
            "hand_index": 1,
            "hand_count": 1,
            "expand_delay_ms": 1000,
            "target": {
                "type": "enemy_follower",
                "index": 3,
                "count": 4
            },
            "target_delay_ms": 1500
        },
        {
            "action": "attack",
            "label": "二攻骑士清除剩余二血守护",
            "change_roi": "hand_and_board",
            "post_timeout_ms": 10000,
            "after_ms": 2500,
            "attacker_index": 2,
            "ally_count": 5,
            "target": {
                "type": "enemy_follower",
                "index": 1,
                "count": 2
            }
        },
        {
            "action": "attack",
            "label": "下一名二攻骑士清除一血守护",
            "change_roi": "hand_and_board",
            "post_timeout_ms": 10000,
            "after_ms": 2500,
            "attacker_index": 2,
            "ally_count": 4,
            "target": {
                "type": "enemy_follower",
                "index": 1,
                "count": 1
            }
        }
    ]
}
