{
    "id": "spec_rodeo_bishop_02",
    "name": "熟练运用罗德欧主教吧！",
    "category": "puzzle",
    "reference_resolution": [
        1280,
        720
    ],
    "navigation": {
        "display_name": "熟练运用罗德欧主教吧！",
        "name_pattern": ".*熟练运用罗德欧主教.*",
        "categories": [
            {
                "display_name": "盘面解谜",
                "pattern": "盘面解(密|谜)|盤面解(密|謎)",
                "scope": "tab"
            },
            {
                "display_name": "指定系列",
                "pattern": "指定系列",
                "scope": "tab"
            },
            {
                "display_name": "罗德欧主教",
                "pattern": "^罗德欧主教$",
                "scope": "list"
            }
        ],
        "entry_wait_ms": 3500,
        "search_swipes": 8
    },
    "steps": [
        {
            "action": "attack",
            "label": "第一只神圣猎鹰先攻击主战者两点",
            "change_roi": "hand_and_board",
            "post_timeout_ms": 10000,
            "after_ms": 5000,
            "attacker_index": 3,
            "ally_count": 4,
            "target": {
                "type": "enemy_leader"
            }
        },
        {
            "action": "activate_amulet",
            "label": "启动莉莉艾的鼓舞，将已攻击的猎鹰变为第三张护符",
            "change_roi": "hand_and_board",
            "post_timeout_ms": 10000,
            "after_ms": 4000,
            "amulet_index": 2,
            "ally_count": 4,
            "target": {
                "type": "ally_follower",
                "index": 3,
                "count": 4
            },
            "target_delay_ms": 2000
        },
        {
            "action": "play_card",
            "label": "罗德欧入场召唤第二个月影指环，抽取的牌不使用",
            "change_roi": "hand_and_board",
            "post_timeout_ms": 10000,
            "after_ms": 4000,
            "hand_index": 1,
            "hand_count": 3,
            "expand_delay_ms": 1000
        },
        {
            "action": "attack",
            "label": "第二只猎鹰攻击主战者至六血",
            "change_roi": "hand_and_board",
            "post_timeout_ms": 10000,
            "after_ms": 5000,
            "attacker_index": 3,
            "ally_count": 5,
            "target": {
                "type": "enemy_leader"
            }
        },
        {
            "action": "end_turn",
            "label": "回合结束，两个月影指环各造成三点伤害",
            "change_roi": "hand_and_board",
            "post_timeout_ms": 10000,
            "after_ms": 12000
        }
    ]
}
